{
  "created_at": "2026-04-22T00:00:00Z",
  "evidence_refs": [
    "generated/multi_office_train_clean_flow/release_train.json"
  ],
  "id": "service_escalation_signal_v1_example",
  "kind": "service_escalation_signal_v1",
  "notes": "Example artifact for service_escalation_signal_v1.",
  "owner_repo": "aoa-routing",
  "reason": "material_contradiction",
  "source_office": "monitor.assistant",
  "status": "draft",
  "target_layer": "agonic_or_cognitive",
  "version": "1.1.0"
}